{
  "$schema": "https://json-schema.org/draft/2020-12/schema",
  "$id": "presidency-meta.schema.json",
  "title": "meta.json",
  "description": "Build metadata, terms, coverage and provenance of the presidency directory",
  "type": "object",
  "additionalProperties": false,
  "required": [
    "schema_version",
    "scope",
    "generatedAt",
    "terms",
    "coverage",
    "statusRules",
    "sources"
  ],
  "properties": {
    "schema_version": {
      "type": "integer",
      "const": 4
    },
    "scope": {
      "type": "string",
      "const": "presidencia"
    },
    "generatedAt": {
      "type": "string",
      "pattern": "^\\d{4}-\\d{2}-\\d{2}T\\d{2}:\\d{2}:\\d{2}Z$"
    },
    "terms": {
      "type": "array",
      "items": {
        "$ref": "#/$defs/term"
      }
    },
    "coverage": {
      "type": "object",
      "additionalProperties": false,
      "required": [
        "terms",
        "unmatchedVotes",
        "excludedBeforeFirstTerm",
        "missingCamaraStage",
        "approvedWithoutLaw",
        "jointRollCallsWithoutVotes"
      ],
      "properties": {
        "terms": {
          "type": "array",
          "items": {
            "$ref": "#/$defs/termRow"
          }
        },
        "unmatchedVotes": {
          "type": "object",
          "additionalProperties": false,
          "required": [
            "camara",
            "senado"
          ],
          "properties": {
            "camara": {
              "type": "integer",
              "minimum": 0
            },
            "senado": {
              "type": "integer",
              "minimum": 0
            }
          }
        },
        "excludedBeforeFirstTerm": {
          "type": "integer",
          "minimum": 0
        },
        "missingCamaraStage": {
          "type": "integer",
          "minimum": 0
        },
        "approvedWithoutLaw": {
          "type": "integer",
          "minimum": 0
        },
        "jointRollCallsWithoutVotes": {
          "type": "integer",
          "minimum": 0
        }
      }
    },
    "statusRules": {
      "type": "object",
      "additionalProperties": false,
      "required": [
        "version"
      ],
      "properties": {
        "version": {
          "type": "integer",
          "minimum": 1
        }
      }
    },
    "sources": {
      "type": "array",
      "items": {
        "$ref": "#/$defs/source"
      }
    }
  },
  "$defs": {
    "term": {
      "type": "object",
      "additionalProperties": false,
      "required": [
        "id",
        "start",
        "end",
        "holder",
        "sourceUrl"
      ],
      "properties": {
        "id": {
          "type": "string",
          "pattern": "^\\d{4}-\\d{4}$"
        },
        "start": {
          "type": "string",
          "pattern": "^\\d{4}-\\d{2}-\\d{2}$"
        },
        "end": {
          "type": "string",
          "pattern": "^\\d{4}-\\d{2}-\\d{2}$"
        },
        "holder": {
          "type": [
            "string",
            "null"
          ]
        },
        "sourceUrl": {
          "type": [
            "string",
            "null"
          ],
          "pattern": "^https://"
        }
      },
      "description": "One presidential term (door 3)"
    },
    "termRow": {
      "type": "object",
      "additionalProperties": false,
      "required": [
        "term",
        "provisionalMeasure",
        "veto",
        "bill"
      ],
      "properties": {
        "term": {
          "type": "string",
          "pattern": "^\\d{4}-\\d{4}$"
        },
        "provisionalMeasure": {
          "type": "object",
          "additionalProperties": false,
          "required": [
            "total",
            "pending",
            "approved",
            "approvedAmended",
            "rejected",
            "lapsed",
            "revoked",
            "returned"
          ],
          "properties": {
            "total": {
              "type": "integer",
              "minimum": 0
            },
            "pending": {
              "type": "integer",
              "minimum": 0
            },
            "approved": {
              "type": "integer",
              "minimum": 0
            },
            "approvedAmended": {
              "type": "integer",
              "minimum": 0
            },
            "rejected": {
              "type": "integer",
              "minimum": 0
            },
            "lapsed": {
              "type": "integer",
              "minimum": 0
            },
            "revoked": {
              "type": "integer",
              "minimum": 0
            },
            "returned": {
              "type": "integer",
              "minimum": 0
            }
          }
        },
        "veto": {
          "type": "object",
          "additionalProperties": false,
          "required": [
            "total",
            "pending",
            "decided",
            "devices"
          ],
          "properties": {
            "total": {
              "type": "integer",
              "minimum": 0
            },
            "pending": {
              "type": "integer",
              "minimum": 0
            },
            "decided": {
              "type": "integer",
              "minimum": 0
            },
            "devices": {
              "type": "object",
              "additionalProperties": false,
              "required": [
                "kept",
                "overridden",
                "prejudged",
                "pending",
                "total"
              ],
              "properties": {
                "kept": {
                  "type": "integer",
                  "minimum": 0
                },
                "overridden": {
                  "type": "integer",
                  "minimum": 0
                },
                "prejudged": {
                  "type": "integer",
                  "minimum": 0
                },
                "pending": {
                  "type": "integer",
                  "minimum": 0
                },
                "total": {
                  "type": "integer",
                  "minimum": 0
                }
              }
            }
          }
        },
        "bill": {
          "type": "object",
          "additionalProperties": false,
          "required": [
            "total",
            "inProgress",
            "law",
            "vetoedTotally",
            "withdrawn",
            "archived"
          ],
          "properties": {
            "total": {
              "type": "integer",
              "minimum": 0
            },
            "inProgress": {
              "type": "integer",
              "minimum": 0
            },
            "law": {
              "type": "integer",
              "minimum": 0
            },
            "vetoedTotally": {
              "type": "integer",
              "minimum": 0
            },
            "withdrawn": {
              "type": "integer",
              "minimum": 0
            },
            "archived": {
              "type": "integer",
              "minimum": 0
            }
          }
        }
      }
    },
    "source": {
      "type": "object",
      "additionalProperties": false,
      "required": [
        "file",
        "sourceUrl",
        "sha256",
        "bytes",
        "downloadedAt"
      ],
      "properties": {
        "file": {
          "type": "string"
        },
        "sourceUrl": {
          "type": "string"
        },
        "sha256": {
          "type": "string",
          "pattern": "^[0-9a-f]{64}$"
        },
        "bytes": {
          "type": "integer",
          "minimum": 0
        },
        "downloadedAt": {
          "type": "string",
          "pattern": "^\\d{4}-\\d{2}-\\d{2}T\\d{2}:\\d{2}:\\d{2}Z$"
        }
      }
    }
  }
}
