{"coverage":{"approvedWithoutLaw":0,"excludedBeforeFirstTerm":1,"jointRollCallsWithoutVotes":1,"missingCamaraStage":1,"terms":[{"bill":{"archived":1,"inProgress":1,"law":4,"total":7,"vetoedTotally":0,"withdrawn":1},"provisionalMeasure":{"approved":1,"approvedAmended":1,"lapsed":2,"pending":1,"rejected":0,"returned":0,"revoked":1,"total":6},"term":"2023-2026","veto":{"decided":4,"devices":{"kept":2,"overridden":4,"pending":1,"prejudged":1,"total":8},"pending":1,"total":5}}],"unmatchedVotes":{"camara":0,"senado":0}},"generatedAt":"2026-09-27T12:00:00Z","schema_version":4,"scope":"presidencia","sources":[{"bytes":1079,"downloadedAt":"2026-09-27T12:00:00Z","file":"congresso/dispositivo-43265.json","sha256":"9e3c951ed4dda547947ae07ec3debb072b7bd09e1b38cac15346c33a6410840a","sourceUrl":"https://legis.senado.leg.br/dadosabertos/plenario/resultado/veto/dispositivo/43265"},{"bytes":1748,"downloadedAt":"2026-09-27T12:00:00Z","file":"congresso/dispositivo-43825.json","sha256":"86ebe50746eefc764bffcbb26e6bc6e42c92c46aba6e9418fc3dbb4fa94071a6","sourceUrl":"https://legis.senado.leg.br/dadosabertos/plenario/resultado/veto/dispositivo/43825"},{"bytes":1051,"downloadedAt":"2026-09-27T12:00:00Z","file":"congresso/dispositivo-43828.json","sha256":"1ccf10edbdd91062d1ca5c1ff32c264bf4b0b219abe9f1dd94eb2cfa6fe0494f","sourceUrl":"https://legis.senado.leg.br/dadosabertos/plenario/resultado/veto/dispositivo/43828"},{"bytes":1512,"downloadedAt":"2026-09-27T12:00:00Z","file":"congresso/dispositivo-45468.json","sha256":"151c330992fa611aceb4f4ebb12eab608dde7efa0986094356e0bdcd1e723911","sourceUrl":"https://legis.senado.leg.br/dadosabertos/plenario/resultado/veto/dispositivo/45468"},{"bytes":1764,"downloadedAt":"2026-09-27T12:00:00Z","file":"congresso/dispositivo-46051.json","sha256":"4353c2ed3d766f5359a71b3555a81bdd8b8d063c39e0741a185d91c2f6fe2b94","sourceUrl":"https://legis.senado.leg.br/dadosabertos/plenario/resultado/veto/dispositivo/46051"},{"bytes":4384,"downloadedAt":"2026-09-27T12:00:00Z","file":"congresso/processo-mpv-2023.json","sha256":"81c30e0eaef833303d522acfb1e6729bb463f9bd2919e0017940a2c20bdfeaba","sourceUrl":"https://legis.senado.leg.br/dadosabertos/processo?sigla=MPV&ano=2023"},{"bytes":2,"downloadedAt":"2026-09-27T12:00:00Z","file":"congresso/processo-mpv-2025.json","sha256":"4f53cda18c2baa0c0354bb5f9a3ecbe5ed12ab4d8e11ba873c2f11161202b945","sourceUrl":"https://legis.senado.leg.br/dadosabertos/processo?sigla=MPV&ano=2025"},{"bytes":745,"downloadedAt":"2026-09-27T12:00:00Z","file":"congresso/processo-mpv-2026.json","sha256":"c6da9f9b58d2eda7f763572e26ba6795d698603338bbdb8432948b673323c7c9","sourceUrl":"https://legis.senado.leg.br/dadosabertos/processo?sigla=MPV&ano=2026"},{"bytes":100,"downloadedAt":"2026-09-27T12:00:00Z","file":"congresso/processo-pec-9103-2026.json","sha256":"2206545b9d13d63a8897b24fbef4cc8aff3a7dbc71578dc1b037b47418d8a47f","sourceUrl":"https://legis.senado.leg.br/dadosabertos/processo?sigla=PEC&numero=9103&ano=2026"},{"bytes":2,"downloadedAt":"2026-09-27T12:00:00Z","file":"congresso/processo-pl-1084-2023.json","sha256":"4f53cda18c2baa0c0354bb5f9a3ecbe5ed12ab4d8e11ba873c2f11161202b945","sourceUrl":"https://legis.senado.leg.br/dadosabertos/processo?sigla=PL&numero=1084&ano=2023"},{"bytes":1093,"downloadedAt":"2026-09-27T12:00:00Z","file":"congresso/processo-pl-3626-2023.json","sha256":"08ca675151e49c2b5f568487b42ce47b06c62a5d5bb8afcc5e970de365ba4fc6","sourceUrl":"https://legis.senado.leg.br/dadosabertos/processo?sigla=PL&numero=3626&ano=2023"},{"bytes":779,"downloadedAt":"2026-09-27T12:00:00Z","file":"congresso/processo-pl-6233-2023.json","sha256":"8312496cfb745b48a075966e32a8974af80a547677369f1ffd9200ad00c6346c","sourceUrl":"https://legis.senado.leg.br/dadosabertos/processo?sigla=PL&numero=6233&ano=2023"},{"bytes":2,"downloadedAt":"2026-09-27T12:00:00Z","file":"congresso/processo-pl-9101-2023.json","sha256":"4f53cda18c2baa0c0354bb5f9a3ecbe5ed12ab4d8e11ba873c2f11161202b945","sourceUrl":"https://legis.senado.leg.br/dadosabertos/processo?sigla=PL&numero=9101&ano=2023"},{"bytes":2,"downloadedAt":"2026-09-27T12:00:00Z","file":"congresso/processo-pl-9102-2025.json","sha256":"4f53cda18c2baa0c0354bb5f9a3ecbe5ed12ab4d8e11ba873c2f11161202b945","sourceUrl":"https://legis.senado.leg.br/dadosabertos/processo?sigla=PL&numero=9102&ano=2025"},{"bytes":1156,"downloadedAt":"2026-09-27T12:00:00Z","file":"congresso/processo-plp-93-2023.json","sha256":"fb13d17ca9c06961ae93fb59d1425553c683e7c60047671f6864631387ff5368","sourceUrl":"https://legis.senado.leg.br/dadosabertos/processo?sigla=PLP&numero=93&ano=2023"},{"bytes":4049,"downloadedAt":"2026-09-27T12:00:00Z","file":"congresso/veto-158326.json","sha256":"5e9369e20b31d5eb9d42d38dd486f0714a07b87ed072f5d9e7ada66dbe64f931","sourceUrl":"https://legis.senado.leg.br/dadosabertos/plenario/resultado/veto/materia/158326"},{"bytes":5276,"downloadedAt":"2026-09-27T12:00:00Z","file":"congresso/veto-161861.json","sha256":"c38ef2602b15fc65037384372f3a15933b194b1ecd8c1f4284f7617cdd616ab5","sourceUrl":"https://legis.senado.leg.br/dadosabertos/plenario/resultado/veto/materia/161861"},{"bytes":13257,"downloadedAt":"2026-09-27T12:00:00Z","file":"congresso/veto-166980.json","sha256":"2547f4a17fa3a9cb5d122b398c717132d405078e0a09626d7feb03f2fcef844c","sourceUrl":"https://legis.senado.leg.br/dadosabertos/plenario/resultado/veto/materia/166980"},{"bytes":7189,"downloadedAt":"2026-09-27T12:00:00Z","file":"congresso/veto-169775.json","sha256":"1e1744d7e92ea417f48e4cf18119dfcf13ed0811121cc3115aa50a05ee407f65","sourceUrl":"https://legis.senado.leg.br/dadosabertos/plenario/resultado/veto/materia/169775"},{"bytes":5498,"downloadedAt":"2026-09-27T12:00:00Z","file":"congresso/veto-172342.json","sha256":"99a0b7c3c3a850311554910afc7c01063bf190e4a94801b446e09bcf8673f5b5","sourceUrl":"https://legis.senado.leg.br/dadosabertos/plenario/resultado/veto/materia/172342"},{"bytes":5265,"downloadedAt":"2026-09-27T12:00:00Z","file":"congresso/vetos-2023.json","sha256":"591bb4aab09d42e2fa2edf2f7e6f6454611fab680bc619a53a9ca383aba2a361","sourceUrl":"https://legis.senado.leg.br/dadosabertos/materia/vetos/2023"},{"bytes":4881,"downloadedAt":"2026-09-27T12:00:00Z","file":"congresso/vetos-2025.json","sha256":"80cf79972b80c8ecb6788a9474c2c55a3104e021cd70db8046595bc6712c5a6b","sourceUrl":"https://legis.senado.leg.br/dadosabertos/materia/vetos/2025"},{"bytes":2309,"downloadedAt":"2026-09-27T12:00:00Z","file":"congresso/vetos-2026.json","sha256":"c27de5908bb6cab55a06de425d4f2cb54710d7f657724a6894ac7afcd9985758","sourceUrl":"https://legis.senado.leg.br/dadosabertos/materia/vetos/2026"},{"bytes":2311,"downloadedAt":"2026-09-27T12:00:00Z","file":"proposicoes-2023.csv","sha256":"945bdd72ef891f65c8b001162468372ac7e3f2ecf537ab9a45f3ae180281e356","sourceUrl":"https://dadosabertos.camara.leg.br/arquivos/proposicoes/csv/proposicoes-2023.csv"},{"bytes":324,"downloadedAt":"2026-09-27T12:00:00Z","file":"proposicoes-2025.csv","sha256":"4ffd9d3b116e7a7c8121c585e4efb598feab2bb7b90f5c1678fbee9516015fe0","sourceUrl":"https://dadosabertos.camara.leg.br/arquivos/proposicoes/csv/proposicoes-2025.csv"},{"bytes":375,"downloadedAt":"2026-09-27T12:00:00Z","file":"proposicoes-2026.csv","sha256":"fc9e06d3aa714ba9bf96369768620ea209ef6e011d3b7e5b2be3ad34b37daef1","sourceUrl":"https://dadosabertos.camara.leg.br/arquivos/proposicoes/csv/proposicoes-2026.csv"},{"bytes":1485,"downloadedAt":"2026-09-27T12:00:00Z","file":"proposicoesAutores-2023.csv","sha256":"03ce0fb1fd4f0a2be18c5d81182c088eed71667dd4f0f47f7d9457d5c09cf6c4","sourceUrl":"https://dadosabertos.camara.leg.br/arquivos/proposicoesAutores/csv/proposicoesAutores-2023.csv"},{"bytes":275,"downloadedAt":"2026-09-27T12:00:00Z","file":"proposicoesAutores-2025.csv","sha256":"3e39c7e4869bb9933a199b2b98e2d58397bfb369a8bae51fdf383331bfdc3c1d","sourceUrl":"https://dadosabertos.camara.leg.br/arquivos/proposicoesAutores/csv/proposicoesAutores-2025.csv"},{"bytes":275,"downloadedAt":"2026-09-27T12:00:00Z","file":"proposicoesAutores-2026.csv","sha256":"79e0496a42fb79679c9083b4a62ed6e25f638cf85bec36f680cd674650402cfa","sourceUrl":"https://dadosabertos.camara.leg.br/arquivos/proposicoesAutores/csv/proposicoesAutores-2026.csv"}],"statusRules":{"version":1},"terms":[{"end":"2027-01-04","holder":"Luiz Inácio Lula da Silva","id":"2023-2026","sourceUrl":"https://legis.senado.leg.br/dadosabertos/plenario/resultado/cn/20230101","start":"2023-01-01"}]}
